{
  "id": "ptu-core-only",
  "name": "PTU 1.05 Core Only",
  "version": "1.0.0",
  "description": "Only the PTU 1.05 Core rules/data available in the supplied source set.",
  "packs": [
    {
      "id": "ptu-core-1.05",
      "enabled": true,
      "priority": 100
    }
  ],
  "version_pins": {},
  "gm_overrides_enabled": true
}
