{
  "id": "ptu-official-supplements",
  "name": "PTU Core + Official Supplements",
  "version": "1.0.0",
  "description": "Core plus Blessed and the Damned, Do Porygon Dream of Mareep?, and Game of Throhs; playtests disabled.",
  "packs": [
    {
      "id": "ptu-core-1.05",
      "enabled": true,
      "priority": 100
    },
    {
      "id": "ptu-blessed-and-damned",
      "enabled": true,
      "priority": 110
    },
    {
      "id": "ptu-do-porygon-dream-of-mareep",
      "enabled": true,
      "priority": 110
    },
    {
      "id": "ptu-game-of-throhs",
      "enabled": true,
      "priority": 110
    }
  ],
  "version_pins": {},
  "gm_overrides_enabled": true
}
